Product Name;Description;Price;Website;On Promotion;ID;Category
Samsung Galaxy Watch 4;The Samsung Galaxy Watch 4 smartwatch offers advanced health features, including sleep and heart rate tracking. 2-year warranty included.;299.99;https://www.samsung.com;Yes;11;Smartwatches
Ralph Lauren Polo Shirt;The Ralph Lauren polo shirt is a timeless garment, offering stylish elegance and optimal comfort. Made from high-quality cotton. 1-year warranty included.;95.00;https://www.ralphlauren.com;No;7;Shirts
LG Gram 17;The LG Gram 17 laptop offers exceptional portability with a 17-inch screen, an Intel i7 processor, and 16 GB of RAM. 2-year warranty included.;1799.99;https://www.lg.com;Yes;2;Computers
Sony WH-1000XM4;The Sony WH-1000XM4 wireless headphones offer advanced active noise cancellation and exceptional sound quality. 2-year warranty included.;349.99;https://www.sony.com;No;4;Audio Electronics
Apple iPad Pro;The Apple iPad Pro offers outstanding performance with a Liquid Retina display, an M1 chip, and 5G capabilities. 1-year warranty included.;999.99;https://www.apple.com;No;1;Tablets
Nespresso VertuoPlus;The Nespresso VertuoPlus coffee machine offers a variety of coffee sizes with a convenient capsule system and optimal extraction. 2-year warranty included.;199.99;https://www.nespresso.com;No;17;Kitchen
Microsoft Surface Pro 7;The Microsoft Surface Pro 7 tablet offers PC-like performance with tablet flexibility, equipped with an Intel i5 processor and 8GB of RAM. 2-year warranty included.;899.99;https://www.microsoft.com;Yes;1;Tablets
Philips Hue Smart Bulbs;Philips Hue smart bulbs offer customizable lighting with smartphone or voice assistant control. 2-year warranty included.;99.99;https://www.philips-hue.com;No;26;Smart Home
KitchenAid Artisan Mixer;The KitchenAid Artisan stand mixer offers exceptional performance with a large capacity and multiple accessories. 2-year warranty included.;499.99;https://www.kitchenaid.com;Yes;17;Kitchen
Google Nest Hub;The Google Nest Hub smart assistant offers a touchscreen display to control your connected devices and display useful information. 2-year warranty included.;89.99;https://store.google.com;No;26;Smart Home
Nike Air Zoom Pegasus 37;Nike Air Zoom Pegasus 37 running shoes offer responsive cushioning and optimal support, ideal for runners of all levels. 1-year warranty included.;119.99;https://www.nike.com;Yes;3;Shoes
JBL Charge 5;The JBL Charge 5 portable speaker offers powerful sound with long-lasting battery life and IP67 water resistance. 2-year warranty included.;179.99;https://www.jbl.com;No;4;Audio Electronics
Canon EOS Rebel T7;The Canon EOS Rebel T7 digital SLR camera offers exceptional image quality with a 24.1 MP sensor and user-friendly features. 1-year warranty included.;449.99;https://www.usa.canon.com;Yes;18;Electronics
Tefal ActiFry Genius XL;The Tefal ActiFry Genius XL air fryer allows you to cook healthy meals with little or no oil. 2-year warranty included.;249.99;https://www.tefal.com;No;17;Kitchen
North Face Borealis Backpack;The North Face Borealis backpack offers comfort and functionality with an ergonomic design and multiple compartments. 1-year warranty included.;89.99;https://www.thenorthface.com;Yes;24;Luggage
Crocs Classic Clog;Crocs Classic clogs offer ultimate comfort and exceptional durability, perfect for everyday wear. 1-year warranty included.;44.99;https://www.crocs.com;No;3;Shoes
GoPro HERO9 Black;The GoPro HERO9 Black action camera offers 5K video, advanced stabilization, and exceptional durability. 1-year warranty included.;399.99;https://www.gopro.com;No;18;Electronics
Columbia Newton Ridge Plus;Columbia Newton Ridge Plus hiking boots offer exceptional durability and comfort, perfect for outdoor adventures. 1-year warranty included.;79.99;https://www.columbia.com;Yes;3;Shoes
Logitech MX Master 3;The Logitech MX Master 3 wireless mouse offers exceptional precision and ergonomics, perfect for productivity. 2-year warranty included.;99.99;https://www.logitech.com;No;12;Accessories
Beats by Dre Studio3;Beats by Dre Studio3 wireless headphones offer active noise cancellation and high-quality sound. 2-year warranty included.;349.99;https://www.beatsbydre.com;Yes;4;Audio Electronics
Samsung Galaxy Tab S7;The Samsung Galaxy Tab S7 tablet offers exceptional performance with an 11-inch screen and compatibility with the S Pen. 2-year warranty included.;649.99;https://www.samsung.com;Yes;1;Tablets
Coleman Sundome Tent;The Coleman Sundome tent offers easy setup and weather protection, perfect for camping. 1-year warranty included.;89.99;https://www.coleman.com;No;29;Camping
Hydro Flask Water Bottle;The Hydro Flask water bottle offers exceptional insulation to keep drinks cold or hot. Lifetime warranty.;39.99;https://www.hydroflask.com;Yes;28;Accessories
Milwaukee M18 Drill Set;The Milwaukee M18 drill kit offers exceptional power and durability, perfect for professionals and DIY enthusiasts. 5-year warranty included.;299.99;https://www.milwaukeetool.com;No;25;Tools
Apple AirPods Pro;The Apple AirPods Pro wireless earbuds offer active noise cancellation and high-quality sound. 1-year warranty included.;249.99;https://www.apple.com;Yes;4;Audio Electronics
Brooks Ghost 13;The Brooks Ghost 13 running shoes offer exceptional comfort and support with a cushioned midsole. 1-year warranty included.;129.99;https://www.brooksrunning.com;No;3;Shoes
Cuisinart 12-Cup Coffee Maker;The Cuisinart 12-cup coffee maker offers advanced features for delicious coffee every time. 3-year warranty included.;99.99;https://www.cuisinart.com;Yes;17;Kitchen
Merrell Moab 2;The Merrell Moab 2 hiking shoes offer exceptional comfort and durability with a Vibram outsole. 1-year warranty included.;109.99;https://www.merrell.com;No;3;Shoes
Asus ROG Strix G15;The Asus ROG Strix G15 gaming laptop offers cutting-edge performance with a Ryzen 7 processor and RTX 3050 graphics card. 2-year warranty included.;1299.99;https://www.asus.com;Yes;2;Computers