" ""Nom du Produit""            ";" ""Description""                                                                                                      ";" ""Prix""   ";" ""Site Web""                    ";" ""En Promotion"" ";" ""Identifiant"" ";" ""Catégorie"""
 Acer Predator Helios 300  ; L'ordinateur portable de jeu Acer Predator Helios 300 offre des performances puissantes avec un processeur Intel i7 et une carte graphique NVIDIA GeForce RTX 3060. Garantie de 2 ans. ; 1499.99; https://www.acer.com         ; Oui          ; 2           ; Ordinateurs
 Patagonia Better Sweater ; La veste Patagonia Better Sweater offre un confort et une chaleur exceptionnels, fabriquée avec des matériaux recyclés. Garantie à vie. ; 139.99 ; https://www.patagonia.com   ; Non          ; 14          ; Vêtements
 Apple MacBook Air M1      ; Le MacBook Air M1 d'Apple offre des performances puissantes avec la puce M1, un écran Retina, et une autonomie impressionnante. Garantie de 1 an incluse. ; 999.99 ; https://www.apple.com        ; Oui          ; 2           ; Ordinateurs
 Asics Gel-Kayano 27       ; Les chaussures de course Asics Gel-Kayano 27 offrent un soutien et un confort exceptionnels, idéales pour les longues distances. Garantie de 1 an incluse. ; 159.99 ; https://www.asics.com        ; Non          ; 3           ; Chaussures
 Logitech G502 Hero        ; La souris de jeu Logitech G502 Hero offre une précision et des performances de pointe avec 11 boutons programmables. Garantie de 2 ans incluse. ; 79.99  ; https://www.logitech.com     ; Oui          ; 12          ; Accessoires
 Zara Basic T-Shirt        ; Le t-shirt basique de Zara offre un style simple et confortable, parfait pour les tenues décontractées. Fabriqué en coton de haute qualité. Garantie de 1 an incluse. ; 15.99  ; https://www.zara.com         ; Non          ; 7           ; Chemises
 Dell XPS 13               ; L'ordinateur portable Dell XPS 13 offre des performances puissantes avec un design compact et léger, un écran InfinityEdge, et un processeur Intel i7. Garantie de 2 ans incluse. ; 1399.99; https://www.dell.com         ; Oui          ; 2           ; Ordinateurs
 Ray-Ban Aviator Sunglasses; Les lunettes de soleil Ray-Ban Aviator offrent un style classique et une protection UV optimale. Fabriquées avec des matériaux de haute qualité. Garantie de 1 an incluse. ; 154.99 ; https://www.ray-ban.com      ; Non          ; 28          ; Accessoires
 Sony Alpha a6400          ; L'appareil photo sans miroir Sony Alpha a6400 offre une qualité d'image exceptionnelle avec une mise au point automatique rapide et précise. Garantie de 2 ans incluse. ; 999.99 ; https://www.sony.com         ; Oui          ; 18          ; Électronique
 Nespresso VertuoPlus      ; La machine à café Nespresso VertuoPlus offre une variété de tailles de café avec un système de capsules pratique et une extraction optimale. Garantie de 2 ans incluse. ; 199.99 ; https://www.nespresso.com    ; Non          ; 17          ; Cuisine
 Microsoft Surface Pro 7   ; La tablette Microsoft Surface Pro 7 offre des performances de PC avec la flexibilité d'une tablette, équipée d'un processeur Intel i5 et de 8 Go de RAM. Garantie de 2 ans incluse. ; 899.99 ; https://www.microsoft.com    ; Oui          ; 1           ; Tablettes
 Philips Hue Smart Bulbs   ; Les ampoules intelligentes Philips Hue offrent un éclairage personnalisable avec contrôle via smartphone ou assistant vocal. Garantie de 2 ans incluse. ; 99.99  ; https://www.philips-hue.com  ; Non          ; 26          ; Maison Intelligente
 KitchenAid Artisan Mixer  ; Le batteur sur socle KitchenAid Artisan offre une performance exceptionnelle avec une grande capacité et de multiples accessoires. Garantie de 2 ans incluse. ; 499.99 ; https://www.kitchenaid.com   ; Oui          ; 17          ; Cuisine
 Google Nest Hub           ; L'assistant intelligent Google Nest Hub offre un écran tactile pour contrôler vos appareils connectés et afficher des informations utiles. Garantie de 2 ans incluse. ; 89.99  ; https://store.google.com     ; Non          ; 26          ; Maison Intelligente
 Nike Air Zoom Pegasus 37  ; Les chaussures de course Nike Air Zoom Pegasus 37 offrent un amorti réactif et un soutien optimal, idéales pour les coureurs de tous niveaux. Garantie de 1 an incluse. ; 119.99 ; https://www.nike.com        ; Oui          ; 3           ; Chaussures
 JBL Charge 5              ; L'enceinte portable JBL Charge 5 offre un son puissant avec une batterie de longue durée et une résistance à l'eau IP67. Garantie de 2 ans incluse. ; 179.99 ; https://www.jbl.com         ; Non          ; 4           ; Électronique Audio
 Canon EOS Rebel T7        ; L'appareil photo reflex numérique Canon EOS Rebel T7 offre une qualité d'image exceptionnelle avec un capteur de 24.1 MP et des fonctionnalités conviviales. Garantie de 1 an incluse. ; 449.99 ; https://www.usa.canon.com   ; Oui          ; 18          ; Électronique
 Tefal ActiFry Genius XL   ; La friteuse sans huile Tefal ActiFry Genius XL permet de cuisiner des repas sains avec peu ou pas d'huile. Garantie de 2 ans incluse. ; 249.99 ; https://www.tefal.com       ; Non          ; 17          ; Cuisine
 North Face Borealis Backpack ; Le sac à dos North Face Borealis offre confort et fonctionnalité avec un design ergonomique et de multiples compartiments. Garantie de 1 an incluse. ; 89.99  ; https://www.thenorthface.com; Oui          ; 24          ; Bagagerie
 Crocs Classic Clog        ; Les sabots Crocs Classic offrent un confort ultime et une durabilité exceptionnelle, parfaits pour un usage quotidien. Garantie de 1 an incluse. ; 44.99  ; https://www.crocs.com       ; Non          ; 3           ; Chaussures
 GoPro HERO9 Black         ; La caméra d'action GoPro HERO9 Black offre une vidéo 5K, une stabilisation avancée, et une durabilité exceptionnelle. Garantie de 1 an incluse. ; 399.99 ; https://www.gopro.com       ; Non          ; 18          ; Électronique
 Columbia Newton Ridge Plus ; Les bottes de randonnée Columbia Newton Ridge Plus offrent une durabilité et un confort exceptionnels, parfaites pour les aventures en plein air. Garantie de 1 an incluse. ; 79.99  ; https://www.columbia.com    ; Oui          ; 3           ; Chaussures
 Logitech MX Master 3      ; La souris sans fil Logitech MX Master 3 offre une précision et une ergonomie exceptionnelles, parfaite pour la productivité. Garantie de 2 ans incluse. ; 99.99  ; https://www.logitech.com    ; Non          ; 12          ; Accessoires
 Beats by Dre Studio3      ; Les écouteurs sans fil Beats by Dre Studio3 offrent une réduction de bruit active et un son de haute qualité. Garantie de 2 ans incluse. ; 349.99 ; https://www.beatsbydre.com  ; Oui          ; 4           ; Électronique Audio
 Fitbit Charge 4           ; Le bracelet de fitness Fitbit Charge 4 offre un suivi GPS intégré, un suivi du sommeil et des notifications intelligentes. Garantie de 1 an incluse. ; 149.99 ; https://www.fitbit.com      ; Non          ; 11          ; Montres Intelligentes
 KitchenAid K400 Blender   ; Le blender KitchenAid K400 offre une performance exceptionnelle pour les smoothies, les soupes et plus encore. Garantie de 2 ans incluse. ; 249.99 ; https://www.kitchenaid.com  ; Oui          ; 17          ; Cuisine
 Under Armour HOVR Phantom ; Les chaussures de course Under Armour HOVR Phantom offrent un confort et une réactivité optimaux, avec une technologie de suivi intégré. Garantie de 1 an incluse. ; 140.00 ; https://www.underarmour.com ; Non          ; 3           ; Chaussures
 HP Envy 6055e Printer     ; L'imprimante tout-en-un HP Envy 6055e offre une impression de haute qualité avec des fonctionnalités de numérisation et de copie. Garantie de 1 an incluse. ; 129.99 ; https://www.hp.com          ; Oui          ; 12          ; Accessoires
 Patagonia Nano Puff Jacket; La veste Patagonia Nano Puff offre une isolation légère et une chaleur exceptionnelle, fabriquée avec des matériaux recyclés. Garantie à vie. ; 199.99 ; https://www.patagonia.com   ; Non          ; 14          ; Vêtements
 DJI Mini 2                ; Le drone DJI Mini 2 offre une caméra 4K, une autonomie de vol étendue et des fonctionnalités de vol intelligentes. Garantie de 1 an incluse. ; 449.99 ; https://www.dji.com         ; Oui          ; 18          ; Électronique
 Skechers D'Lites          ; Les chaussures Skechers D'Lites offrent un confort et un style exceptionnels avec une semelle intérieure en mousse à mémoire de forme. Garantie de 1 an incluse. ; 64.99  ; https://www.skechers.com    ; Non          ; 3           ; Chaussures
 Casio CT-X700             ; Le clavier numérique Casio CT-X700 offre une gamme de sons de haute qualité et des fonctionnalités d'apprentissage intégrées. Garantie de 2 ans incluse. ; 199.99 ; https://www.casio.com       ; Oui          ; 20          ; Instruments Musicaux
 Victorinox Swiss Army Knife ; Le couteau suisse Victorinox offre une polyvalence exceptionnelle avec de multiples outils intégrés. Fabriqué en acier inoxydable. Garantie à vie. ; 39.99  ; https://www.victorinox.com  ; Non          ; 25          ; Outillage
 Samsung Galaxy Tab S7     ; La tablette Samsung Galaxy Tab S7 offre des performances exceptionnelles avec un écran de 11 pouces et une compatibilité avec le S Pen. Garantie de 2 ans incluse. ; 649.99 ; https://www.samsung.com     ; Oui          ; 1           ; Tablettes
 Coleman Sundome Tent      ; La tente Coleman Sundome offre une installation facile et une protection contre les intempéries, parfaite pour le camping. Garantie de 1 an incluse. ; 89.99  ; https://www.coleman.com     ; Non          ; 29          ; Camping
 Hydro Flask Water Bottle  ; La bouteille d'eau Hydro Flask offre une isolation exceptionnelle pour garder les boissons froides ou chaudes. Garantie à vie. ; 39.99  ; https://www.hydroflask.com  ; Oui          ; 28          ; Accessoires
 Milwaukee M18 Drill Set   ; Le kit de perceuse Milwaukee M18 offre une puissance et une durabilité exceptionnelles, parfait pour les professionnels et les bricoleurs. Garantie de 5 ans incluse. ; 299.99 ; https://www.milwaukeetool.com; Non          ; 25          ; Outillage
 Apple AirPods Pro         ; Les écouteurs sans fil Apple AirPods Pro offrent une réduction de bruit active et un son de haute qualité. Garantie de 1 an incluse. ; 249.99 ; https://www.apple.com       ; Oui          ; 4           ; Électronique Audio
 Brooks Ghost 13           ; Les chaussures de course Brooks Ghost 13 offrent un confort et un soutien exceptionnels avec une semelle intermédiaire amortissante. Garantie de 1 an incluse. ; 129.99 ; https://www.brooksrunning.com; Non          ; 3           ; Chaussures
 Cuisinart 12-Cup Coffee Maker ; La cafetière Cuisinart 12 tasses offre des fonctionnalités avancées pour un café délicieux à chaque fois. Garantie de 3 ans incluse. ; 99.99  ; https://www.cuisinart.com   ; Oui          ; 17          ; Cuisine
 Merrell Moab 2            ; Les chaussures de randonnée Merrell Moab 2 offrent un confort et une durabilité exceptionnels avec une semelle extérieure Vibram. Garantie de 1 an incluse. ; 109.99 ; https://www.merrell.com     ; Non          ; 3           ; Chaussures
 Asus ROG Strix G15        ; L'ordinateur portable de jeu Asus ROG Strix G15 offre des performances de pointe avec un processeur Ryzen 7 et une carte graphique RTX 3050. Garantie de 2 ans incluse. ; 1299.99; https://www.asus.com        ; Oui          ; 2           ; Ordinateurs